{
  "ticker": "NVDA",
  "output_mode": "A",
  "run_context": {
    "run_id": "20260313T000000Z_NVDA_A_LEGACY",
    "artifact_root": "output/runs/20260313T000000Z_NVDA_A_LEGACY/NVDA",
    "ticker": "NVDA",
    "reports_dir": "output/reports",
    "snapshot_dir": "output/data/NVDA",
    "migration_mode": "legacy_promotion"
  },
  "patch_plan_path": "output/runs/20260313T000000Z_NVDA_A_LEGACY/NVDA/patch-plan.json",
  "source_analysis_result_path": "output/runs/20260313T000000Z_NVDA_A_LEGACY/NVDA/analysis-result.json",
  "target_analysis_result_path": "output/runs/20260313T000000Z_NVDA_A_LEGACY/NVDA/analysis-result.json",
  "task_ids": [
    "01_mechanism_test"
  ],
  "updated_paths": [
    "$.top_risks"
  ],
  "render_required": true,
  "preserve_untouched_sections": true,
  "updates": [
    {
      "task_id": "01_mechanism_test",
      "path": "$.top_risks",
      "value": [
        "Cloud customers delay AI server deployments -> accelerator orders slip -> revenue growth decelerates -> operating leverage fades -> forward multiple compresses below 20x."
      ],
      "rationale": "Implements the critic-requested event-to-revenue-to-margin-to-multiple chain in the single top-risk line."
    }
  ],
  "applied_by": "analyst-patch-executor",
  "applied_at": "2026-03-28T04:05:00Z"
}
